category,sentence
card,"The [BRAND] prescription savings card functions independently of insurance, serving as a valuable option whether or not you are insured."
card,[BRAND] is striving to build an America that is both healthier and more prosperous.
card,[BRAND] can assist you in reducing your expenses below the regular cash price when purchasing prescription medications.
card,"With [BRAND], you have the capability to retrieve the most substantial discount currently offered."
service,"[BRAND] is recognized at outstanding pharmacies across the country, including well-known chain stores!"
service,"[BRAND] is recognized at more than 88,000 pharmacies across the country."
service,The innovative solutions offered by [BRAND] will bring you joy.
service,[BRAND] employs cutting-edge AI technologies to respond to a wider range of inquiries.
service,Experience a more advanced healthcare through the technology provided by [BRAND].
service,Locate the most competitively priced medications in your vicinity using [BRAND]'s mobile app.
service,"The app ensures that prices remain consistent, both on the app and at the pharmacy."
cost,"[BRAND] has secured discounts on prescriptions, saving you extra money."
cost,Save up to 80% on retail prices with [BRAND]'s exclusive discounts on RX prescriptions and pharmaceuticals.
cost,"With [BRAND], you can cut costs on prescriptions without additional charges."
cost,"Reduce prescription drug expenses by up to 80% with [BRAND], often surpassing average copays."
cost,Pharmacies across the street from each other may have prescription costs differing by over $100.
cost,"Even with insurance, prescription drug prices can surpass expectations."
insurance,"Despite having the best health insurance, out-of-pocket costs persist when visiting the doctor."
insurance,"Insurance may not cover certain pharmaceuticals, or the deductible might be excessively high."
insurance,Many insurance plans have elevated deductibles or restricted formularies that exclude necessary drugs.
insurance,Insurance companies have shifted 25-80% more of the drug cost burden onto patients in the past decade.
health,"For everyone, good health is undoubtedly the most crucial aspect."
health,"True wealth is health, and prioritizing it is vital for a prosperous life."
health,"Maintaining a healthy body requires effort, but it is not an overly challenging task."
health,Health is a primary focus because an unhealthy body is susceptible to numerous diseases.
medication,Both exercise and nutrition significantly impact the body's fat storage.
medication,Adhering to prescribed medication is crucial.
medication,"[BRAND] provides access to over 55,000 FDA approved medications."
medication,"To maximize the benefits of medications, it's essential to follow the doctor's instructions precisely."
patients,Taking medications at the correct time is crucial not only for financial reasons but also for health and well-being.
patients,[BRAND] assists patients and employees in saving significant amounts while maintaining good health.
patients,"[BRAND] caters to everyone, whether insured, uninsured, or Medicare recipients."
temp1,"In the face of escalating prescription prices and the prevalence of high deductible health plans and copays, [BRAND] can assist anyone."
temp1,Caring for ourselves and our loved ones is of utmost importance.
temp2,The well-being of our loved ones brings us the greatest happiness.
temp2,Optimal health enables us to enjoy life to the fullest and tackle life's challenges.
chronic,"Good health facilitates focus on work, instills energy, and promotes happiness."
chronic,Maintaining ongoing prescription medication without a healthcare plan would be expensive.
chronic,Regular medication is necessary for managing chronic conditions.
chronic,Chronic diseases typically require long-term management.
chronic,"Proper medication adherence is crucial for controlling chronic conditions, addressing temporary ailments, and ensuring overall long-term health and well-being."